term,definition,ipa,synonyms,antonyms
mercurial,""" adj. (of a person) subject to sudden or unpredictable changes of mood or mind. """"his mercurial temperament"""" """,ˌmərˈkyo͝orēəl,"volatile, capricious, temperamental, excitable, fickle, changeable, unpredictable, variable, protean, mutable, erratic, quicksilver, inconstant, inconsistent, unstable, unsteady, fluctuating, ever-changing, moody, flighty, wayward, whimsical, impulsive antonyms: stable",stable
mollify,""" v. appease the anger or anxiety of (someone). """"nature reserves were set up around the power stations to mollify local conservationists"""" """"they tried to mollify the protesters"""" """,ˈmäləˌfī,"appease, placate, pacify, conciliate, soothe, calm (down)",enrage
neophyte,""" n. a person who is new to a subject, skill, or belief. """"four-day cooking classes are offered to neophytes and experts"""" """,ˈnēəˌfīt,"beginner, learner, novice, newcomer",
obfuscate,""" v. render obscure, unclear, or unintelligible. """"the spelling changes will deform some familiar words and obfuscate their etymological origins"""" """"mere rationalizations to obfuscate rather than clarify the real issue"""" """,ˈäbfəˌskāt,"obscure, confuse, make unclear, blur, muddle, complicate, overcomplicate, muddy, cloud, befog",clarify
obstinate,"adj. stubbornly refusing to change one's opinion or chosen course of action, despite attempts to persuade one to do so. synonyms: stubborn, unyielding, inflexible, unbending, intransigent, intractable, obdurate, mulish, bullheaded, stubborn as a mule, pigheaded, self-willed, strong-willed, headstrong, willful, contrary, perverse, recalcitrant, refractory, uncooperative, unmanageable, stiff-necked, rigid, uncompromising, implacable, unrelenting, immovable, unshakable antonyms: compliant",ˈäbstənət,,
ostentatious,""" adj. characterized by vulgar or pretentious display; designed to impress or attract notice. """"books that people buy and display ostentatiously but never actually finish"""" """,ˌästənˈtāSHəs,"showy, pretentious, conspicuous, flamboyant, gaudy, brash, vulgar, loud, extravagant, fancy, ornate, overelaborate antonyms: restrained",restrained
pervade,""" v. (especially of a smell) spread through and be perceived in every part of. """"a smell of stale cabbage pervaded the air"""" """,pərˈvād,"permeate, spread through, fill, suffuse, be diffused through, imbue, penetrate, filter through, percolate through, infuse, perfuse, flow through",
phlegmatic,"adj. (of a person) having an unemotional and stolidly calm disposition. synonyms: calm, cool, composed, 'calm, cool, and collected', controlled, serene, tranquil, placid, impassive, imperturbable, unruffled, dispassionate, philosophical antonyms: excitable",fleɡˈmadik,,
plethora,""" n. a large or excessive amount of (something). """"a plethora of committees and subcommittees"""" """,ˈpleTHərə,"excess, overabundance, superabundance, surplus, glut, superfluity, surfeit, profusion antonyms: dearth",dearth
pristine,""" adj. clean and fresh as if new; spotless. """"a pristine white shirt"""" """"Lurene's clothes are always so pristine"""" """,priˈstēn,"immaculate, perfect, in mint condition, as new, unspoiled, spotless, flawless, impeccable, clean, fresh, new, virgin, pure, unused","dirty, spoiled"
probity,""" n. the quality of having strong moral principles; honesty and decency. """"financial probity"""" """"the committee feels that he has demonstrated little probity in this matter"""" """,ˈprōbədē,"integrity, honesty, uprightness, decency, morality, rectitude, goodness, virtue, right-mindedness, trustworthiness, truthfulness, honor",untrustworthiness
proclivity,""" n. a tendency to choose or do something regularly; an inclination or predisposition toward a particular thing. """"a proclivity for hard work"""" """,prōˈklivədē,"inclination, tendency, leaning, disposition, proneness, propensity, bent, bias, penchant, predisposition",
profligate,""" adj. recklessly extravagant or wasteful in the use of resources. """"profligate consumers of energy"""" """"profligate local authorities"""" """,ˈpräfləɡət,"wasteful, extravagant, spendthrift, improvident, prodigal","thrifty, frugal"
prosaic,""" adj. having the style or diction of prose; lacking poetic beauty. """"prosaic language can't convey the experience""""    adj. commonplace; unromantic. """"the masses were too preoccupied by prosaic day-to-day concerns""""""",prəˈzāik,"ordinary, everyday, commonplace, conventional, straightforward, routine, run-of-the-mill, by-the-numbers, workaday antonyms: interesting, imaginative, inspired","interesting, imaginative, inspired"
quixotic,""" adj. exceedingly idealistic; unrealistic and impractical. """"a vast and perhaps quixotic project"""" """,kwikˈsädik,"idealistic, romantic, visionary, utopian, extravagant, starry-eyed, unrealistic, unworldly",
quotidian,""" adj. ordinary or everyday, especially when mundane. """"his story is an achingly human one, mired in quotidian details"""" """,kwōˈtidēən,"daily, everyday, day-to-day, diurnal antonyms: unusual",unusual
recondite,""" adj. (of a subject or knowledge) little known; abstruse. """"the book is full of recondite information"""" """,ˈrekənˌdīt,"obscure, abstruse, arcane, esoteric, recherché, profound, difficult, complex, complicated, involved",
refulgent,""" adj. shining brightly. """"refulgent blue eyes""""""",rəˈfəljənt,,
renege,""" v. go back on a promise, undertaking, or contract. """"the administration had reneged on its election promises"""" """"he reneged on his campaign promises"""" """,riˈneɡ,"default on, fail to honor, go back on, break, back out of, withdraw from, retreat from, welsh on, backtrack on; break one's word/promise about",honor
sedulous,""" adj. (of a person or action) showing dedication and diligence. """"he watched himself with the most sedulous care"""" """"he picked the thorn from his leg with sedulous care""""""",ˈsejələs,"diligent, careful, meticulous, thorough, assiduous, attentive, industrious, conscientious, ultracareful, punctilious, scrupulous, painstaking, minute, rigorous, particular",
shard,""" n. a piece of broken ceramic, metal, glass, or rock, typically having sharp edges. """"shards of glass flew in all directions"""" """"a shard of glass in her heel""""""",SHärd,"fragment, sliver, splinter, shiver, chip, piece, bit, particle",
soporific,""" adj. tending to induce drowsiness or sleep. """"the motion of the train had a somewhat soporific effect""""   adj. tediously boring or monotonous. """"a libel trial is in large parts intensely soporific"""" """,ˌsäpəˈrifik,"sleep-inducing, sedative, somnolent, calmative, tranquilizing, narcotic, opiate antonyms: invigorating",invigorating
sparse,""" adj. thinly dispersed or scattered. """"areas of sparse population""""    adj. austere; meager. """"an elegantly sparse chamber""""""",spärs,"scant, scanty, scattered, scarce, infrequent, few and far between antonyms: abundant",abundant
spendthrift,"n. a person who spends money in an extravagant, irresponsible way. synonyms: profligate, prodigal, squanderer, waster antonyms: miser, frugal",ˈspen(d)ˌTHrift,,
subtle,""" adj. (especially of a change or distinction) so delicate or precise as to be difficult to analyze or describe. """"his language expresses rich and subtle meanings"""" """"subtle distinctions""""""",ˈsədl,"fine, fine-drawn, nice, hair-splitting",
tacit,""" adj. understood or implied without being stated. """"your silence may be taken to mean tacit agreement"""" """,ˈtasət,"implicit, understood, implied, hinted, suggested antonyms: explicit",explicit
terse,""" adj. sparing in the use of words; abrupt. """"a terse statement"""" """,tərs,"brief, short, to the point, concise, succinct, crisp, pithy, incisive, trenchant, short and sweet, laconic, elliptical antonyms: long-winded, polite","long-winded, polite"
trenchant,""" adj. vigorous or incisive in expression or style. """"she heard angry voices, not loud, yet certainly trenchant"""" """,ˈtren(t)SHənt,"incisive, penetrating, sharp, keen, insightful, acute, focused, shrewd, razor-sharp, piercing antonyms: vague",vague
unfeigned,""" adj. genuine; sincere. """"a broad smile of unfeigned delight"""" """"he looked at his wife with unfeigned admiration"""" """,ˌənˈfānd,"sincere, genuine, real, true, honest, unaffected, unforced, heartfelt, wholehearted, bona fide",insincere
untenable,""" adj. (especially of a position or view) not able to be maintained or defended against attack or objection. """"this argument is clearly untenable"""" """"these untenable explanations are not helping your case""""""",ˌənˈtenəb(ə)l,"indefensible, insupportable, unsustainable, unjustified, unjustifiable, flimsy, weak, shaky",
vacillate,""" v. alternate or waver between different opinions or actions; be indecisive. """"I had for a time vacillated between teaching and journalism"""" """,ˈvasəˌlāt,"dither, waver, be indecisive, be undecided, be ambivalent, hesitate, be of two minds, blow hot and cold, keep changing one's mind, be conflicted",
variegated,""" adj. exhibiting different colors, especially as irregular patches or streaks. """"variegated yellow bricks""""    adj. marked by variety. """"his variegated and amusing observations""""""",ˈver(ē)əˌɡādəd,,
vituperate,"v. blame or insult (someone) in strong or violent language. synonyms: scold, revile, upbraid, criticize antonyms: praise",vəˈtyo͞opərāt,,
volatile,""" adj. (of a substance) easily evaporated at normal temperatures.    adj. liable to change rapidly and unpredictably, especially for the worse. """"the political situation was becoming more volatile"""" """,ˈvälədl,"evaporative, vaporous antonyms: stable, tense, strained, fraught, uneasy, uncomfortable, charged, explosive, inflammatory, turbulent antonyms: stable, calm","stable, stable, calm"
puritanical,"adj. practicing or affecting strict religious or moral behavior. synonyms: moralistic, puritan, pietistic, strait-laced, stuffy, prudish, prim, priggish",ˌpyo͝orəˈtanək(ə)l,,
outlook,""" n. a person's point of view or general attitude to life. """"broaden your outlook on life"""" """"the two men were wholly different in outlook""""   n. a view. """"the pleasant outlook from the lodge window"""" """"a lovely open outlook""""""",ˈoutˌlo͝ok,"point of view, viewpoint, views, opinion, (way of) thinking, perspective, attitude, standpoint, stance, frame of mind, view, vista, prospect, panorama, scene, aspect",
rectify,""" v. put (something) right; correct. """"mistakes made now cannot be rectified later"""" """"Perry is willing to do anything to rectify the situation with his estranged grandfather""""   v. convert (alternating current) to direct current. """"rectified AC power systems""""   v. find a straight line equal in length to (a curve).""",ˈrektəˌfī,"correct, right, put right, put to rights, sort out, deal with, amend, remedy, repair, fix, make good, resolve, settle",
budge,""" v. make or cause to make the slightest movement. """"the line in the bank hasn't budged""""    v. change or make (someone) change an opinion. """"I tried to persuade him, but he wouldn't budge"""" """"they refuse to budge on the issue""""""",bəj,"move, shift, stir, go, give in, give way, yield, change one's mind, acquiesce, compromise, do a U-turn",
halt,"""n. a suspension of movement or activity, typically a temporary one. """"a halt in production"""" """,,"stop, standstill",
quell,""" v. put an end to (a rebellion or other disorder), typically by the use of force. """"extra police were called to quell the disturbance"""" """"troops quelled the unrest""""   v. suppress (a feeling, especially an unpleasant one). """"he spoke up again to quell any panic among the assembled youngsters"""" """"he quelled his misgivings""""""",kwel,"put an end to, put a stop to, end, crush, put down, check, crack down on, curb, nip in the bud, squash, quash, subdue, suppress, overcome, calm, soothe, pacify, settle, quiet, silence, allay, assuage, mitigate, moderate",
teem,""" v. be full of or swarming with. """"every garden is teeming with wildlife"""" """,tēm,"be full of, be filled with, be alive with, be brimming with, abound in, be swarming with, be aswarm with",
decent,""" adj. conforming with generally accepted standards of respectable or moral behavior. """"the good name of such a decent and innocent person""""   adj. of an acceptable standard; satisfactory. """"find me a decent cup of coffee"""" """,ˈdēs(ə)nt,"satisfactory, reasonable, fair, acceptable, adequate, sufficient, ample",
invocation,""" n. the action of invoking something or someone for assistance or as an authority. """"the invocation of new disciplines and methodologies""""   n. the summoning of a deity or the supernatural. """"his invocation of the ancient mystical powers""""""",ˌinvəˈkāSH(ə)n,,
untether,""" v. release or free from a tether. """"I reached the horses and untethered them""""""",ˌənˈteT͟Hər,,
foible,"""n. a minor weakness or eccentricity in someone's character. """"they have to tolerate each other's little foibles"""" """,ˈfoibəl,"weakness, failing, shortcoming, flaw, imperfection, blemish, fault, defect, limitation",
incertitude,""" n. a state of uncertainty or hesitation. """"some schools broke down under the stresses of policy incertitude""""""",inˈsərdəˌt(y)o͞od,,
bellicose,""" adj. demonstrating aggression and willingness to fight. """"a group of bellicose patriots"""" """,ˈbeləˌkōs,"belligerent, aggressive, hostile, warlike, warmongering, hawkish, antagonistic, pugnacious, truculent, confrontational, contentious, militant, combative",
runoff,"n. a further competition, election, race, etc., after a tie or inconclusive result.   n. the draining away of water (or substances carried in it) from the surface of an area of land, a building or structure, etc.",ˈrənäf,,
poised,adj. having a composed and self-assured manner.,poizd,,
dissident,""" n. a person who opposes official policy, especially that of an authoritarian state. """"a dissident who had been jailed by a military regime""""    adj. in opposition to official policy. """"there is only one explicitly dissident voice to be heard"""" """,ˈdisədənt,"dissenter, objector, protester, dissenting, disagreeing",
concession,""" n. a thing that is granted, especially in response to demands; a thing conceded. """"the strikers returned to work having won some concessions"""" """"the government made several concessions""""   n. a preferential allowance or rate given by an organization. """"tax concessions"""" """,kənˈseSHən,"compromise, allowance, exception, reduction, cut, discount, deduction, decrease",
impudence,""" n. the quality of being impudent; impertinence. """"his arrogance and impudence had offended many"""" """,ˈimpyədəns,"impertinence, insolence, effrontery, audacity, cheek, cheekiness, cockiness, brazenness, brass, boldness",
cheek,""" n. either side of the face below the eye. """"tears rolled down her cheeks""""   n. impertinent talk or behavior. """"he had the cheek to complain"""" """,CHēk,"impudence, cheekiness, insolence, effrontery, audacity, impertinence, cockiness",
temerity,""" n. excessive confidence or boldness; audacity. """"no one had the temerity to question his conclusions"""" """,təˈmerədē,"audacity, nerve, effrontery, impudence, impertinence, cheek, gall, presumption",
gall,"""n. bold, impudent behavior. """"the bank had the gall to demand a fee""""    n. the contents of the gallbladder; bile (proverbial for its bitterness). """"scholarly gall was poured on this work""""""",ɡôl,"effrontery, impudence, impertinence, cheek, cheekiness, insolence, audacity, temerity, presumption, cockiness, nerve, shamelessness, disrespect, bad manners, bitterness, resentment, rancor, bile, spleen, malice, spite, spitefulness, malignity, venom, vitriol, poison",
nerve,"""  v. brace oneself mentally to face a demanding situation. """"she nerved herself to enter the room""""""",nərv,,
lassitude,""" n. a state of physical or mental weariness; lack of energy. """"she was overcome by lassitude and retired to bed"""" """"prolonged periods of lassitude""""""",ˈlasəˌt(y)o͞od,"lethargy, listlessness, weariness, languor, sluggishness, tiredness, fatigue, torpor, lifelessness, apathy",
languor,"""n. the state or feeling, often pleasant, of tiredness or inertia. """"he remembered the languor and warm happiness of those golden afternoons""""    n. an oppressive stillness of the air. """"the afternoon was hot, quiet, and heavy with languor"""" """,ˈlaNG(ɡ)ər,"lassitude, lethargy, listlessness, torpor, fatigue, weariness, sleepiness, drowsiness, stillness, tranquility, calm, calmness",
humdrum,""" adj. lacking excitement or variety; dull; monotonous. """"humdrum routine work""""    n. dullness; monotony. """"an escape from the humdrum of his life""""""",ˈhəmˌdrəm,"mundane, dull, dreary, boring, tedious, monotonous, uninvolving, prosaic",
retrieve,"""v. get or bring (something) back; regain possession of. """"I was sent to retrieve the balls from his garden"""" """,rəˈtrēv,"get back, bring back, recover, regain (possession of), recoup, reclaim, repossess, redeem, recuperate",
wreath,"n. an arrangement of flowers, leaves, or stems fastened in a ring and used for decoration or for laying on a grave. synonyms: garland, circlet, chaplet, crown, festoon, lei",rēTH,,
snort,""" v. make a sudden sound through one's nose, especially to express indignation or derision. """"she snorted with laughter""""   v. (of an animal) make a sudden explosive sound through the nose, especially when excited or frightened.""",snôrt,,
austerity,""" n. sternness or severity of manner or attitude. """"he was noted for his austerity and his authoritarianism""""   n. extreme plainness and simplicity of style or appearance. """"the room was decorated with a restraint bordering on austerity""""   n. conditions characterized by severity, sternness, or asceticism. plural noun: austerities """"a simple life of prayer and personal austerity"""" """,ôˈsterədē,"severity, strictness, seriousness, solemnity, gravity",
fashion,"""  n. a manner of doing something. """"the work is done in a rather casual fashion""""    v. make into a particular or the required form. """"the bottles were fashioned from green glass"""" """,ˈfaSHən,"manner, way, method, mode, style, construct, build, make, manufacture, fabricate, tailor, contrive",
barred,""" adj. closed or secured with a long rod or rigid piece of wood, metal, or similar material. """"he sits by a barred window""""   adj. marked with bands of color or light. """"he spotted a barred owl""""""",bärd,,
bigotry,""" n. intolerance toward those who hold different opinions from oneself. """"the difficulties of combating prejudice and bigotry""""""",ˈbiɡətrē,,
abhorrent,""" adj. inspiring disgust and loathing; repugnant. """"racial discrimination was abhorrent to us all"""" """"he continued to find war morally abhorrent""""""",abˈhôrənt,"detestable, hateful, loathsome, despicable, abominable, execrable, repellent, repugnant, repulsive, revolting, disgusting, distasteful, horrible, horrid, horrifying, awful, heinous, reprehensible, obnoxious, odious, nauseating, offensive, contemptible",
aqueous,""" adj. of or containing water, typically as a solvent or medium. """"an aqueous solution of potassium permanganate""""""",ˈakwēəs,,
premises,""" n. a house or building, together with its land and outbuildings, occupied by a business or considered in an official context. """"business premises"""" """"he was asked to leave the premises""""""",ˈpreməsəz,"building(s), property, site, office",
premise,""" v. base an argument, theory, or undertaking on. """"the reforms were premised on our findings""""""",ˈpreməs,,
preface,"""v. provide (a book) with a preface. """"the book is prefaced by a quotation from William Faulkner"""" """"the chapter is prefaced by a poem""""""",ˈprefəs,"precede, introduce, begin, open, start",
exploit,""" v. make full use of and derive benefit from (a resource). """"500 companies sprang up to exploit this new technology"""" """"the most heroic and secretive exploits of the war"""" """,ikˈsploit,"utilize, harness, use, make use of, turnekˌsploit/ n. a bold or daring feat., feat, deed, act, adventure, stunt, escapade",
rumination,""" n. a deep or considered thought about something. """"philosophical ruminations about life and humanity""""   n. the action of chewing the cud. """"cows slow down their rumination""""""",ˌro͞oməˈnāSH(ə)n,,
epithet,""" n. an adjective or descriptive phrase expressing a quality characteristic of the person or thing mentioned. """"old men are often unfairly awarded the epithet “dirty.”"""" """,ˈepəˌTHet,"sobriquet, nickname, byname, title, name, label, tag",
foreboding,""" n. fearful apprehension; a feeling that something bad will happen. """"with a sense of foreboding she read the note""""    adj. implying or seeming to imply that something bad is going to happen. """"when the doctor spoke, his voice was dark and foreboding""""""",fôrˈbōdiNG,"apprehension, anxiety, trepidation, disquiet, unease, uneasiness, misgiving, suspicion, worry, fear, fearfulness, dread, alarm",
usher,""" v. show or guide (someone) somewhere. """"a waiter ushered me to a table"""" """"she ushered him to a window seat""""   v. cause or mark the start of something new. """"the railroads ushered in an era of cheap mass travel"""" """,ˈəSHər,"escort, accompany, take, show, see, lead, conduct, guide, steer, shepherd, marshal, herald, mark the start of, signal, ring in, show in, set the scene for, pave the way for",
unfetter,""" v. release from restraint or inhibition. """"his imagination is unfettered by the laws of logic"""" """"the choice between a planned economy and an unfettered market""""""",ˌənˈfedər,"unrestrained, unrestricted, unconstrained, uninhibited, free, rampant, unbridled, unchecked, unmufflered, uncontrolled",
sentiment,""" n. a view of or attitude toward a situation or event; an opinion. """"I agree with your sentiments regarding the road bridge"""" """"the comments echo my own sentiments""""   n. a feeling or emotion. """"an intense sentiment of horror""""""",ˈsen(t)əmənt,"view, feeling, attitude, thought, opinion, belief",
readily,""" adv. without hesitation or reluctance; willingly. """"he readily admits that the new car surpasses its predecessors"""" """"Durkin readily offered to drive him""""   adv. without delay or difficulty; easily. """"illegal fireworks are readily available"""" """"the island is readily accessible""""""",ˈredəlē,"willingly, without hesitation, unhesitatingly, ungrudgingly, gladly, happily, eagerly, promptly, easily, with ease, without difficulty",
savvy,""" n. shrewdness and practical knowledge; the ability to make good judgments. """"the financiers lacked the necessary political savvy""""    v. know or understand. """"Charley would savvy what to do about such a girl""""   adj. shrewd and knowledgeable; having common sense and good judgment. """,ˈsavē,"shrewdness, astuteness, sharp-wittedness, sharpness, acuteness, acumen, acuity, intelligence, wit, canniness, common sense, discernment, insight, understanding, penetration, perception, perceptiveness, perspicacity, knowledge, sagacity, shrewd, astute, sharp-witted, sharp, acute, adroit, intelligent, clever, canny, perceptive, perspicacious, sagacious, sage, wise",
beleaguer,""" v. lay siege to. """"he is leading a relief force to the aid of the beleaguered city"""" """"the beleaguered garrison""""   v. beset with difficulties. """"the board is supporting the beleaguered director amid calls for his resignation"""" """,bəˈlēɡər,"besieged, under siege, blockaded, surrounded, encircled, beset, hemmed in, under attack, hard-pressed, troubled, in difficulties, under pressure, under stress, with one's back to the wall, in a tight corner, in a tight spot, up against it",
levy,""" v. impose (a tax, fee, or fine). """"a new tax could be levied on industry to pay for cleaning up contaminated land"""" """"the government's right to levy taxes""""""",ˈlevē,"impose, charge, exact, raise, collect",
aggrieved,""" adj. feeling resentment at having been unfairly treated. """"they were aggrieved at the outcome"""" """,əˈɡrēvd,"resentful, affronted, indignant, disgruntled, discontented, upset, offended, piqued, riled, nettled, vexed, irked, irritated, annoyed, put out, chagrined",
perch,""" n. a thing on which a bird alights or roosts, typically a branch or a horizontal rod or bar in a birdcage. """"the chicken's perch""""   v. (of a bird) alight or rest on something. """"a herring gull perched on the mast"""" """,pərCH,"pole, rod, branch, roost, rest, resting place, roost, sit, rest",
animus,""" n. hostility or ill feeling. """"the author's animus toward her""""""",ˈanəməs,,
revoke,""" v. put an end to the validity or operation of (a decree, decision, or promise). """"the men appealed and the sentence was revoked"""" """,rəˈvōk,"cancel, repeal, rescind, reverse, annul, nullify, void, invalidate, countermand, retract, withdraw, overrule, override",
bail,""" n. the temporary release of an accused person awaiting trial, sometimes on condition that a sum of money be lodged to guarantee their appearance in court. """"he has been released on bail""""    v. release or secure the release of (a prisoner) on payment of bail. """"his son called home to get bailed out of jail""""""",bāl,"surety, security, assurance, indemnity, indemnification",
