term,definition,ipa,synonyms,antonyms
#separator:tab,,,,
#html:false,,,,
marginal,"""adj. of secondary or minor importance; not central. """"it seems likely to make only a marginal difference"""" """"the difference is marginal""""""",,"slight, small, tiny, minute, insignificant, minimal, negligible",
idiosyncrasy,""" n. a mode of behavior or way of thought peculiar to an individual. """"one of his little idiosyncrasies was always preferring to be in the car first""""   n. a distinctive or peculiar feature or characteristic of a place or thing. """"the idiosyncrasies of the prison system"""" """,ˌidēəˈsiNGkrəsē,"peculiarity, individual/personal trait, oddity, eccentricity, mannerism, quirk, whim, whimsy, fancy, fad, vagary, notion, conceit, caprice, kink, twist, freak, fetish, passion, bent, foible, crotchet, habit, characteristic, speciality, quality, feature",
incendiary,""" adj. capable of catching fire spontaneously; arousing to action or rebellion """"incendiary bombs""""  """,inˈsendēˌerē,"combustible, flammable, inflammable",
presumptuous,""" adj.(of a person or their behavior) failing to observe the limits of what is permitted or appropriate. """"I hope I won't be considered presumptuous if I offer some advice"""" """"the duchess would not put up with presumptuous servants""""""",prəˈzəm(p)(t)SH(o͞o)əs,"brazen, overconfident, arrogant, bold, audacious, forward, familiar, impertinent, insolent, impudent, cocky",
discern,""" v. distinguish (someone or something) with difficulty by sight or with the other senses. """"she could faintly discern the shape of a skull"""" """,dəˈsərn,"perceive, make out, pick out, detect, recognize, notice, observe, see, spot",
portcullis,n. gate consisting of an iron or wooden grating that hangs in the entry to a castle or fortified town,ˌpôrtˈkələs,,
provenance,""" n. the place of origin or earliest known history of something. """"an orange rug of Iranian provenance"""" """,ˈprävənəns,"origin, source, place of origin",
harness,""" n. a set of straps and fittings by which a horse or other draft animal is fastened to a cart, plow, etc., and is controlled by its driver.    v. control and make use of (natural resources), especially to produce energy. """"attempts to harness solar energy"""" """,ˈhärnəs,"tack, tackle, equipment, control, exploit, utilize, use, employ, make use of, put to use",
quench,""" v. satisfy (a desire). """"he only pursued her to quench an aching need""""    v. extinguish (a fire). """"firemen hauled on hoses in a desperate bid to quench the flames"""" """"the flames were quenched""""""",kwen(t)SH,"satisfy, slake, sate, satiate, gratify, relieve, assuage, take the edge off, indulge, extinguish, put out, snuff out, smother, douse",
quiescent,""" adj. in a state or period of inactivity or dormancy. """"strikes were headed by groups of workers who had previously been quiescent"""" """,kwēˈesnt,"inactive, inert, idle, dormant, at rest, inoperative, deactivated, quiet antonyms: active",active
fiducial,adj. based on trust; used as a fixed standard of reference for comparison or measurement,fəˈdo͞oSH(ē)əl,,
ancillary,""" adj. providing necessary support to the primary activities or operation of an organization, institution, industry, or system. """"the development of ancillary services to support its products""""   adj. additional; subsidiary. """"paragraph 19 was merely ancillary to paragraph 16"""" """,ˈansəˌlerē,"additional, auxiliary, supporting, helping, extra, supplementary, supplemental, accessory, attendant",
resilient,""" adj. (of a person or animal) able to withstand or recover quickly from difficult conditions. """"babies are generally far more resilient than new parents realize""""    adj. (of a substance or object) able to recoil or spring back into shape after bending, stretching, or being compressed. """"a shoe with resilient cushioning"""" """,rəˈzilyənt,"strong, tough, hardy, flexible, pliable, supple",
hypnotize,""" v. produce a state of hypnosis in (someone). """"a witness had been hypnotized to enhance his memory"""" """"he had been hypnotized as a stunt""""   v. capture the whole attention of (someone); fascinate. """"hypnotized by the rain, Eric stared across the street"""" """"they were hypnotized by the dancers""""""",ˈhipnəˌtīz,"mesmerize, put into a trance, entrance, mesmerize, spellbind, enthrall, transfix, captivate, bewitch, charm, enrapture, grip, rivet, absorb, fascinate, magnetize",
lethargic,""" adj. affected by lethargy; sluggish and apathetic. """"I felt tired and a little lethargic"""" """,ləˈTHärjik,"sluggish, inert, inactive, underactive, slow, torpid, lifeless",
apt,""" adj. appropriate or suitable in the circumstances. """"an apt description of her nature"""" """"a very apt description of how I felt""""    adj. having a tendency to do something. """"she was apt to confuse the past with the present"""" """"they're apt to get a bit sloppy"""" """,apt,"suitable, fitting, appropriate, befitting, relevant, germane, applicable, apposite, inclined, given, likely, liable, disposed, predisposed, prone","inappropriate, unlikely"
tautology,""" n. the saying of the same thing twice in different words, generally considered to be a fault of style (e.g., they arrived one after the other in succession). """"avoid such tautology as """"let's all work together, everyone, as a team"""" by saying simply """"let's work together""""""""""",tôˈtäləjē,"pleonasm, repetition, reiteration, redundancy, superfluity, duplication",
concur,"""  v. be of the same opinion; agree. """"the authors concurred with the majority"""" """"The rules of the game require you to accept the umpire's decision, even if you do not concur with it.""""   v. happen or occur at the same time; coincide. """"in tests, cytogenetic determination has been found to concur with enzymatic determination"""" """"the two events concurred""""""",kənˈkər,"agree, be in agreement, go along, fall in, be in sympathy antonyms: disagree, coincide, be simultaneous, be concurrent, coexist",disagree
digress,""" v. leave the main subject temporarily in speech or writing. """"I have digressed a little from my original plan"""" """"At one point, the speaker digressed to tell of an incident in her childhood, but then she got right back to the topic.""""""",dīˈɡres,"deviate, go off on a tangent, get off the subject, get sidetracked, lose the thread, turn aside/away, depart, drift, stray, wander",
galore,""" adj. in abundance. """"there were prizes galore for everything"""" """,ɡəˈlôr,"aplenty, in abundance, in profusion, in great quantities, in large numbers, by the dozen",
hostile,"""adj. unfriendly; antagonistic. """"a hostile audience"""" """,,"unfriendly, unkind, bitter, unsympathetic, malicious, vicious, rancorous, venomous, poisonous, virulent antonyms: friendly, mild","friendly, mild"
inter,""" v. put into the earth; entomb  """"he was interred with the military honors due to him""""""",ɪnˈtəː,,
novice,""" n. a person new to or inexperienced in a field or situation. """"he was a complete novice in foreign affairs"""" """,ˈnävəs,"beginner, learner, neophyte, newcomer, initiate, tyro, fledgling antonyms: expert, veteran","expert, veteran"
suffice,""" v. be enough, adequate; serve  """"a quick look should suffice"""" """"a simple yes or no will suffice""""""",səˈfīs,"be enough, be sufficient, be adequate, do, serve, meet requirements, satisfy demands, answerserve the purpose",
mingle,""" v. mix or cause to mix together. """"the sound of voices mingled with a scraping of chairs"""" """"fact and fiction are skillfully mingled in his novels"""" """,ˈmiNGɡəl,"mix, blend, intermingle, intermix, interweave, interlace, combine, merge, fuse, unite, join, amalgamate, meld, mesh","separate, be separated"
pounce,""" v. move down on as if in an attack """"The bird quickly pounced its prey.""""""",pouns,,
flutter,""" v. (of a bird or other winged creature) flap (its wings) quickly and lightly. """"the lark fluttered its wings, hovering"""" """,ˈflədər,"flap, move up and down, beat, quiver, agitate, vibrate, whiffle",
astonish,""" v. surprise or impress (someone) greatly. """"you never fail to astonish me"""" """,əˈstäniSH,"amaze, astound, stagger, surprise, startle, stun, confound, dumbfound, strike dumb, boggle, stupefy, daze, shock, take aback, leave open-mouthed, leave aghast",
daub,""" v. coat, cover, plaster, slather """"Jeffrey decorated his room by daubing red paint in patches all over his walls.""""  """"he daubed a rock with paint""""""",dôb,"smear, bedaub, plaster, splash, spatter, splatter, cake, cover, smother, coat",
feat,""" n. achievement, exploit """"The Taj Mahal is considered a remarkable feat of engineering.""""  """"the new printing presses were considerable feats of engineering"""" """,fēt,"achievement, accomplishment, attainment, coup, triumph",
intrigue,""" v. arouse the curiosity or interest of; fascinate. """"I was intrigued by your question"""" """"Young albert was intrigued by the mysteries of science.""""     v. make secret plans to do something illicit or detrimental to someone; plot, conspire """"the delegates were intriguing for their own gains"""" """"The police didn't believe Jim intrigued with the enemy against the government.""""""",inˈtrēɡ,"interest, be of interest to, fascinate, arouse someone's curiosity, arouse someone's interest, pique someone's curiosity, pique someone's interest, attract",
luxuriant,""" adj. rich and profuse in growth; lush. """"forests of dark, luxuriant foliage""""    """"Tracts of luxuriant plant life and colonies of teeming insects cover the Amazon river basin.""""""",ˌləkˈSHo͝orēənt,"lush, rich, abundant, profuse, exuberant, opulent, riotous, prolific, vigorous antonyms: barren, sparse","barren, sparse"
render,""" v. provide or give (a service, help, etc.). """"money serves as a reward for services rendered""""    v. cause to be or become; make. """"the rains rendered his escape impossible"""" """"her fury rendered her speechless""""   v. represent or depict artistically. """"the eyes and the cheeks are exceptionally well rendered"""" """,ˈrendər,"give, provide, supply, furnish, contribute, make, cause to be/become, leave, paint, draw, depict, portray, represent, execute",
renowned,""" adj. known or talked about by many people; famous. """"a restaurant renowned for its Southwestern-style food"""" """"a renowned Indian filmmaker"""" """,rəˈnound,"famous, celebrated, famed, eminent, distinguished, acclaimed, illustrious, preeminent, prominent, great, esteemed, of note, of repute, well known, well-thought-of",unknown
rugged,""" adj. (of ground or terrain) having a broken, rocky, and uneven surface. """"a rugged coastline"""" """"the rugged coast path meanders among tall cliffs""""   adj. (of a machine or other manufactured object) strongly made and capable of withstanding rough handling. """"the binoculars are compact, lightweight, and rugged"""" """"the sort of conditions which could tear a wheel off a less rugged vehicle""""   adj. having or requiring toughness and determination. """"a week of rugged, demanding adventure at an outdoor training center"""" """"a rugged outdoor life""""""",ˈrəɡəd,"rough, uneven, bumpy, rocky, stony, irregular, pitted, broken up, jagged, craggy, precipitous, durable, robust, sturdy, strong, strongly made, hardwearing, built to last, tough, resilient, austere, tough, harsh, spartan, exacting, taxing, demanding, difficult, hard, arduous, rigorous, strenuous, onerous",
speculative,""" adj. engaged in, expressing, or based on conjecture rather than knowledge. """"discussion of the question is largely speculative"""" """,ˈspekyəˌlādiv,"conjectural, suppositional, theoretical, hypothetical, putative, academic, notional, abstract",
subordinate,""" adj. lower in rank or position. """"his subordinate officers"""" """"subordinate staff""""     v. of less or secondary importance. """"in adventure stories, character must be subordinate to action"""" """,səˈbôrd(ə)nət,"lower-ranking, junior, lower, supporting, secondary, lesser, minor, subsidiary, subservient, ancillary, auxiliary, peripheral, marginal antonyms: central","senior, central"
torrential,""" adj. (of rain) falling rapidly and in copious quantities. """"a torrential downpour""""  """"he would never forget the misery associated with those torrential rains"""" """"The village was flooded after eight hours of torrential rains.""""""",təˈren(t)SHəl,"copious, heavy, teeming, pelting, severe, relentless, violent",
assume,""" v. suppose to be the case, without proof. """"you're afraid of what people are going to assume about me"""" """"I assumed he wanted me to keep the book""""  v. take or begin to have (power or responsibility). """"he assumed full responsibility for all organizational work"""" """"they are to assume more responsibility""""   v. take on (a specified quality, appearance, or extent). """"militant activity had assumed epidemic proportions"""" """"the disease may assume epidemic proportions""""""",əˈso͞om,"presume, suppose, take it (as given), take for granted, take as read, conjecture, surmise, conclude, deduce, infer, reckon, reason, think, fancy, believe, understand, gather, figure, accept, shoulder, bear, undertake, take on/up, manage, handle, deal with, acquire, take on, come to have",
attain,""" v. succeed in achieving (something that one desires and has worked for). """"clarify your objectives and ways of attaining them"""" """,əˈtān,"achieve, accomplish, reach, obtain, gain, procure, secure, get, hook, net, win, earn, acquire",
cede,""" v. give up (power or territory). """"they have had to cede control of the schools to the government"""" """,sēd,"surrender, concede, relinquish, yield, part with, give up",
glossy,"""adj. shiny and smooth. """"thick, glossy, manageable hair"""" """,,"shiny, gleaming, lustrous, brilliant, shimmering, glistening, satiny, sheeny, smooth, glassy antonyms: dull, lusterless","dull, lusterless"
hallmark,""" n. a mark stamped on articles of gold, silver, or platinum in Britain, certifying their standard of purity. """"the hallmark on silver""""""",ˈhôlˌmärk,"assay mark, official mark, stamp of authenticity",
linger,""" v. stay in a place longer than necessary, typically because of a reluctance to leave. """"she lingered in the yard, enjoying the warm sunshine""""    “Her perfume lingered on”""",ˈliNGɡər,"wait around, stay, remain, wait, stay put, tarry; lag, procrastinate, loiter antonyms: leave",leave
loathe,""" v. feel intense dislike or disgust for. """"she loathed him on sight"""" """"The reclusive celebrity loathes interviews and being photographed.""""""",rəˈpəɡnəns,"hate, detest, abhor, execrate, have a strong aversion to, feel repugnance toward, not be able to bear/stand, be repelled by antonyms: love",love
observe,""" v. fulfill or comply with (a social, legal, ethical, or religious obligation). """"a tribunal must observe the principles of natural justice"""" """"both countries agreed to observe the ceasefire"""" """"The Fosters observe the tradition of a family get-together every last Saturday of the month.""""""",əbˈzərv,"comply with, abide by, keep, obey, adhere to, heed, honor, be heedful of, respect, follow, consent to, acquiesce in, accept, fulfill","disregard, ignore"
engrossed,""" adj. having all one's attention or interest absorbed by someone or something. """"they seemed to be engrossed in conversation""""""",inˈɡrōst,,
ingrained,""" adj. (of a habit, belief, or attitude) firmly fixed or established; difficult to change. """"his deeply ingrained Catholic convictions"""" """,inˈɡrānd,"entrenched, established, deep-rooted, deep-seated, fixed, firm, unshakable, ineradicable, well established antonyms: transient",transient
utterly,""" adv. completely and without qualification; absolutely. """"he looked utterly ridiculous"""" """,ˈədərlē,"completely, totally, absolutely, entirely, wholly, fully, thoroughly, quite, altogether, one hundred percent, downright, outright, unqualifiedly, in all respects, unconditionally, perfectly, implicitly, unrestrictedly, really, veritably, categorically, consummately, undisputedly, unmitigatedly, wholeheartedly, radically, stark, just, to the hilt, to the core, all the way, to the maximum extent, extremely, infinitely, unlimitedly, limitlessly, ultimately",
afford,""" v. provide or supply (an opportunity or facility). """"the rooftop terrace affords beautiful views"""" """,əˈfôrd,"provide, supply, furnish, offer, give, make available, yield",
irreparable,"""/i(r)ˈrep(ə)rəb(ə)l adj. (of an injury or loss) impossible to rectify or repair. """"they were doing irreparable damage to my heart and lungs"""" """"irreparable damage to the landing module"""" """"The soldier survived but suffered irreparable facial damage.""""""",,"irreversible, irrevocable, irrecoverable, unrepairable, beyond repair, unfixable, unrectifiable; hopeless",repairable
outstanding,""" adj. remaining to be paid, done, or dealt with. """"how much work is still outstanding?"""" """,ˌoutˈstandiNG,"to be done, undone, not done, neglected, omitted, unattended to, unfinished, incomplete, left, remaining, pending, ongoing",
proposition,""" n. a statement or assertion that expresses a judgment or opinion. """"the proposition that all men are created equal"""" """"the analysis derives from one proposition""""   n. a suggested scheme or plan of action, especially in a business context. """"a detailed investment proposition"""" """"a business proposition""""""",ˌpräpəˈziSH(ə)n,"theory, hypothesis, thesis, argument, premise, principle, theorem, concept, idea, statement, proposal, scheme, plan, project, idea, program, bid",
solitary,""" adj. done or existing alone. """"I live a pretty solitary life"""" """,ˈsäləˌterē,"lonely, companionless, unaccompanied, by oneself, on one's own, alone, friendless antonyms: sociable",sociable
vagary,""" n. an unexpected and inexplicable change in a situation or in someone's behavior. """"the vagaries of the weather"""" """,ˈvāɡərē,"change, fluctuation, variation, quirk, peculiarity, oddity, eccentricity, unpredictability, caprice, foible, whim, whimsy, fancy",
morbid,""" adj. characterized by or appealing to an abnormal and unhealthy interest in disturbing and unpleasant subjects, especially death and disease. """"he had long held a morbid fascination with the horrors of contemporary warfare""""    병적인""",ˈmôrbəd,"ghoulish, macabre, unhealthy, gruesome, unwholesome antonyms: wholesome",wholesome
hem,""" n. the edge of a piece of cloth or clothing that has been turned under and sewn. """"the hem of her dress""""   v. surround and restrict the space or movement of. """"he was hemmed in by the tables""""""",hem,"edge, edging, border, trim, trimming",
claustrophobia,n. an abnormal fear of being in enclosed or narrow places,,,
agoraphobia,"n. an abnormal fear of being in crowds, public places, or open areas, sometimes accompanied by anxiety attacks.",ˌaɡərəˈfōbēə,,
acrophobia,n. a pathological fear of heights,ˌakrəˈfōbēə,,
menagerie,""" n. a collection of wild or unusual animals, especially for exhibition """"Some other specimen in the television menagerie""""""",məˈnajərē,,
slugfest,"n. a tough and challenging contest, especially in sports such as boxing and baseball",ˈsləɡˌfest,,
extradition,""" n. the surrender of an accused or convicted person by one state or country to another (usually under the provisions of a statute or treaty) """"They fought to prevent his extradition to the US""""  """"detainees awaiting extradition""""""",ˌekstrəˈdiSH(ə)n,"deportation, repatriation, expulsion",
detain,""" v. keep (someone) from proceeding; hold back. """"she made to open the door, but he detained her"""" """,dəˈtān,"delay, hold up, make late, keep, slow up/down",
conundrum,""" n. a confusing and difficult problem or question  """"one of the most difficult conundrums for the experts"""" """"the conundrums facing policy-makers""""""",kəˈnəndrəm,"problem, difficult question, difficulty, quandary, dilemma",
perspire,""" v. give out sweat through the pores of the skin as a result of heat, physical exertion, or stress. """"Will was perspiring heavily"""" """,pərˈspī(ə)r,"sweat, be dripping/pouring with sweat, glow, be damp, be wet, break out in a sweat",
lull,""" v. calm or send to sleep, typically with soothing sounds or movements. """"the rhythm of the boat lulled her to sleep"""" """,ləl,"soothe, calm, hush; rock antonyms: waken, agitate","waken, agitate"
takeover,"n. an act of assuming control of something, especially the buying out of one company by another synonyms: buyout, merger, amalgamation",ˈtākˌōvər,,
onset,""" n. the beginning of something, especially something unpleasant. """"the onset of winter"""" """"they foolishly ignored the onset of his aggressive behavior"""" """,ˈônˌset,"start, beginning, commencement, arrival, (first) appearance, inception, emergence, day one, outbreak, dawn, genesis",end
unwittingly,adv. without being aware; unintentionally,ˌənˈwidiNGlē,,
vigilant,""" adj. keeping careful watch for possible danger or difficulties. """"the burglar was spotted by vigilant neighbors"""" """,ˈvijələnt,"watchful, observant, attentive, alert, eagle-eyed, hawk-eyed, on the lookout, on one's toes, on the qui vive antonyms: inattentive",inattentive
clutter,""" v. crowd (something) untidily; fill with clutter. """"his apartment was cluttered with paintings and antiques"""" """"the garden was cluttered with tools""""   n. an untidy state. """"the room was in a clutter of smelly untidiness"""" """"a clutter of toys""""""",ˈklədər,"litter, mess up, disarrange; be strewn, be scattered, mess, jumble, litter, heap, tangle, muddle, hodgepodge",
altercation,""" n. a noisy argument or disagreement, especially in public  """"I had an altercation with the conductor"""" """,ˌôltərˈkāSH(ə)n,"argument, quarrel, squabble, fight, shouting match, disagreement, contretemps, difference of opinion, falling-out, dispute, disputation, clash, fracas, wrangle, blowup, skirmish, run-in, war of words, donnybrook",
quadriplegic,""" adj. affected by or relating to paralysis of all four limbs; tetraplegic. """"quadriplegic patients""""    n. a person affected by paralysis of all four limbs  """"a car accident left him a quadriplegic""""""",ˌkwädrəˈplējik,,
strive,""" v. make great efforts to archieve or obtain something   v. struggle or fight vigorously. """"scholars must strive against bias"""" """,strīv,"try (hard), attempt, endeavor, aim, venture, make an effort, exert oneself, do one's best, do all one can, do one's utmost, labor, work",
manifest,""" adj. clear or obvious to the eye or mind  """"the system's manifest failings"""" """"his manifest lack of interest""""    v. be evidence of; prove. """"bad industrial relations are often manifested in disputes and strikes"""" """"his positive potential is manifested by his art"""" """,ˈmanəˌfest,"obvious, clear, plain, apparent, evident, patent, palpable, distinct, definite, blatant, overt, glaring, barefaced, explicit, transparent, conspicuous, undisguised, unmistakable, noticeable, perceptible, visible, recognizable, be evidence of, be a sign of, indicate, show, attest to, reflect, bespeak, prove, establish, evidence, substantiate, corroborate, confirm","secret, mask"
evasive,""" adj. tending to avoid commitment or self-revelation, especially by responding only indirectly  """"she was evasive about her phone number"""" """,əˈvāsiv,"equivocal, prevaricating, elusive, ambiguous, noncommittal, vague, inexplicit, unclear",
construe,""" v. interpret (a word or action) in a particular way. """"his words could hardly be construed as an apology"""" """"I'm not sure you've properly construed what I just said""""""",kənˈstro͞o,"interpret, understand, read, see, take, take to mean, regard",
attest,""" v. provide or serve as clear evidence of  """"his status is attested by his recent promotion""""  """,əˈtest,"certify, corroborate, confirm, verify, substantiate, authenticate, evidence, demonstrate, show, prove antonyms: disprove",disprove
disdain,"""  n. the feeling that someone or something is unworthy of one's consideration or respect; contempt. """"her upper lip curled in disdain""""     v. consider to be unworthy of one's consideration. """"gamblers disdain four-horse races"""" """,disˈdān,"contempt, scorn, scornfulness, contemptuousness, derision, disrespect antonyms: respect, scorn, deride, pour scorn on, regard with contempt, sneer at, sniff at, curl one's lip at, look down one's nose at, look down on",respect
expedite,""" v. make (an action or process) happen sooner or be accomplished more quickly. """"he promised to expedite economic reforms"""" """,ˈekspəˌdīt,"speed up, accelerate, hurry, hasten, step up, quicken, precipitate, dispatch",
pungent,""" adj. having a sharply strong taste or smell  """"the pungent smell of frying onions""""    adj. (of comment, criticism, or humor) having a sharp and caustic quality. """"pungent remarks"""" """,ˈpənjənt,"strong, powerful, pervasive, penetrating antonyms: bland, mild, caustic, biting, trenchant, cutting, acerbic, sardonic, sarcastic, scathing, acrimonious, barbed, sharp, tart, incisive, bitter, venomous, waspish","bland, mild, bland, mild"
heighten,"""  v. make or become more intense. """"the pleasure was heightened by the sense of guilt that accompanied it"""" """,ˈhītn,"intensify, increase, enhance, add to, augment, boost, strengthen, deepen, magnify, amplify, aggravate, reinforce antonyms: reduce",reduce
