term,definition,ipa,synonyms,antonyms
vitriolic,""" adj. filled with bitter criticism or malice. """"vitriolic attacks on the politicians"""" """,ˌvitrēˈälik,"acrimonious, rancorous, bitter, caustic, mordant, acerbic, trenchant, virulent, spiteful, savage, venomous, poisonous, malicious, splenetic",
virile,"adj. (of a man) having strength, energy, and a strong sex drive. synonyms: manly, masculine, male",ˈvirəl,,
virtuoso,""" n. a person highly skilled in music or another artistic pursuit. """"a celebrated clarinet virtuoso"""" """,ˌvərCHəˈwōsō,"genius, expert, master, past master, maestro, artist, prodigy, marvel, adept, professional, doyen, veteran",
surly,""" adj. bad-tempered and unfriendly. """"he left with a surly expression"""" """,ˈsərlē,"sullen, sulky, moody, sour, unfriendly, unpleasant, scowling, unsmiling",
subvert,""" v. undermine the power and authority of (an established system or institution). """"an attempt to subvert democratic government"""" """,səbˈvərt,"destabilize, unsettle, overthrow, overturn",
sonorous,""" adj. capable of producing a deep or ringing sound. """"the alloy is sonorous and useful in making bells"""" """"a sonorous voice""""   adj. (of a speech or style) using imposing language. """"they had expected the lawyers to deliver sonorous lamentations"""" """,ˈsänərəs,"resonant, rich, full, round, booming, deep, clear, mellow, orotund, fruity, strong, resounding, reverberant, impressive, imposing, grandiloquent, magniloquent, high-flown, lofty, orotund, bombastic, grandiose, pompous, pretentious, overblown, turgid",
accomplice,"n. a person who helps another commit a crime. synonyms: partner in crime, associate, accessory, abettor, confederate, collaborator, fellow conspirator, co-conspirator",əˈkämpləs,,
fugitive,""" n. a person who has escaped from a place or is in hiding, especially to avoid arrest or persecution. """"fugitives from justice"""" """"a hunted fugitive""""""",ˈfyo͞ojədiv,"escapee, runaway, deserter, absconder; refugee",
persevere,""" v. continue in a course of action even in the face of difficulty or with little or no prospect of success. """"his family persevered with his treatment"""" """,ˌpərsəˈvir,"persist, continue, carry on, go on, keep on, keep going, struggle on, hammer away, be persistent, be determined, seeahead, not take no for an answer, be tenacious, stand one's ground, stand fast/firm, hold on, go the distance, stay the course, plod on, stop at nothing, leave no stone unturned",
nonchalant,""" adj. (of a person or manner) feeling or appearing casually calm and relaxed; not displaying anxiety, interest, or enthusiasm. """"she gave a nonchalant shrug"""" """,ˌnänSHəˈlänt,"calm, composed, unconcerned, cool, ‘calm, cool, and collected’, cool as a cucumber",
mettlesome,""" adj. (of a person or animal) full of spirit and courage. """"their horses were beasts of burden, not mettlesome chargers""""""",ˈmedlsəm,,
marginalize,""" v. treat (a person, group, or concept) as insignificant or peripheral. """"attempting to marginalize those who disagree"""" """,ˈmärjənəˌlīz,"sideline, trivialize",
juxtapose,""" v. place or deal with close together for contrasting effect. """"black-and-white photos of slums were starkly juxtaposed with color images"""" """,ˈjəkstəˌpōz,"place side by side, set side by side, collocate, mix",
extricate,""" v. free (someone or something) from a constraint or difficulty. """"he was trying to extricate himself from official duties"""" """"there's always someone who can extricate these wealthy little brats from their run-ins with the law""""""",ˈekstrəˌkāt,"extract, free, release, disentangle, get out, remove, withdraw, disengage",
hortatory,""" adj. tending or aiming to exhort. """"the central bank relied on hortatory messages and voluntary compliance""""""",ˈhôrdəˌtôrē,,
infatuate,""" v. be inspired with an intense but short-lived passion or admiration for. """"she is infatuated with a handsome police chief"""" """,inˈfaCHəˌwāt,"besotted with, in love with, head over heels about, obsessed with, taken with, lovesick for, moonstruck over",
facilitate,""" v. make (an action or process) easy or easier. """"schools were located on the same campus to facilitate the sharing of resources"""" """,fəˈsiləˌtāt,"make easysmoother, smooth the way for",
retrench,""" v. (of a company, government, or individual) reduce costs or spending in response to economic difficulty. """"as a result of the recession the company retrenched"""" """"we have to retrench""""""",rəˈtren(t)SH,"economize, cut back, make cutbacks, make savings, make economies, reduce expenditure, be economical, be frugal, tighten one's belt",
entrench,""" v. establish (an attitude, habit, or belief) so firmly that change is very difficult or unlikely. """"ageism is entrenched in our society"""" """,inˈtren(t)SH,"establish, settle, lodge, set, root, install, plant, embed, seat",
emulate,"""  v. match or surpass (a person or achievement), typically by imitation. """"lesser men trying to emulate his greatness"""" """, ˈemyəˌlāt,"imitate, copy, mirror, echo, follow, model oneself on",
egalitarian,""" adj. relating to or believing in the principle that all people are equal and deserve equal rights and opportunities. """"a fairer, more egalitarian society""""   n. a person who advocates or supports egalitarian principles.""",iˌɡaləˈterēən,,
devious,""" adj. showing a skillful use of underhanded tactics to achieve goals. """"he's as devious as a politician needs to be""""    adj. (of a route or journey) longer and less direct than the most straightforward way. """"they arrived at the town by a devious route"""" """"a devious route around the coast""""""",ˈdēvēəs,"underhanded, deceitful, dishonest, dishonorable, unethical, unprincipled, immoral, unscrupulous, fraudulent, dubious, unfair, treacherous, duplicitous, circuitous, roundabout, indirect, meandering, winding, tortuous",
demarcate,""" v. set the boundaries or limits of. """"plots of land demarcated by barbed wire""""   v. separate or distinguish from. """"art was being demarcated from the more objective science"""" """"the building lots were demarcated with stakes and orange tape""""""",dēˈmärˌkāt,"separate, divide, mark (out/off), delimit, delineate; bound",
delude,""" v. impose a misleading belief upon (someone); deceive; fool. """"too many theorists have deluded the public"""" """,dəˈlo͞od,"mislead, deceive, fool, take in, trick, dupe, hoodwink, gull, lead on",
deference,""" n. humble submission and respect. """"he addressed her with the deference due to age"""" """,ˈdef(ə)rəns,"respect, respectfulness, dutifulness",
counterfeit,"""adj. made in exact imitation of something valuable or important with the intention to deceive or defraud. """"two men were remanded on bail on a charge of passing counterfeit $10 bills""""    v. imitate fraudulently. """"my signature is extremely hard to counterfeit"""" """,ˈkoun(t)ərˌfit,"fake, faked, bogus, forged, imitation, spurious, substitute, ersatz, phony, fake, forge, copy, reproduce, imitate",
despicable,""" adj. deserving hatred and contempt. """"a despicable crime"""" """,dəˈspikəb(ə)l,"contemptible, loathsome, hateful, detestable, reprehensible, abhorrent, abominable, awful, heinous",
contemptuous,""" adj. showing contempt; scornful. """"she was intolerant and contemptuous of the majority of the human race"""" """,kənˈtempCHo͞oəs,"scornful, disdainful, disrespectful, insulting, insolent, derisive, mocking, sneering, scoffing, withering, scathing, snide",
bemuse,""" v. puzzle, confuse, or bewilder (someone). """"her bemused expression"""" """,bəˈmyo͞oz,"bewildered, confused, puzzled, perplexed, baffled, mystified, nonplussed, muddled, befuddled, dumbfounded, at sea, at a loss, taken aback, disoriented, disconcerted",
befuddle,""" v. make (someone) unable to think clearly. """"he has an air of befuddled unworldliness"""" """"befuddled from the anesthesia""""""",bəˈfədl,"confused, muddled, addled, bewildered, disoriented, fazed, perplexed, dazed, dizzy, stupefied, groggy, muzzy, foggy, fuddled, fuzzy, dopey, woozy, befogged, mixed up",
detest,""" v. dislike intensely. """"of all birds the carrion crow is the most detested by gamekeepers"""" """"the only vegetable I truly detest is turnip""""""",dəˈtest,"abhor, hate, loathe, despise, shrink from, be unable to bear, find intolerable, dislike, disdain, have an aversion to",
condone,""" v. accept and allow (behavior that is considered morally wrong or offensive) to continue. """"the college cannot condone any behavior that involves illicit drugs""""    v. approve or sanction (something), especially with reluctance. """"the practice is not officially condoned by any airline""""""",kənˈdōn,"disregard, accept, allow, let pass, turn a blind eye to, overlook, forget",
callous,""" adj. showing or having an insensitive and cruel disregard for others. """"his callous comments about the murder made me shiver"""" """"his callous disregard for other people's feelings""""""",ˈkaləs,"heartless, unfeeling, uncaring, cold, cold-hearted, hard, as hard as nails, hard-hearted, insensitive, lacking compassion, hard-bitten, hard-nosed, hard-edged, unsympathetic",
aloof,""" adj. not friendly or forthcoming; cool and distant. """"they were courteous but faintly aloof"""" """"part of their strategy is to remain aloof during the first stages of negotiation""""""",əˈlo͞of,"distant, detached, unfriendly, antisocial, unsociable, avoidant, remote, unapproachable, formal, stiff, withdrawn, reserved, unforthcoming, uncommunicative, unsympathetic",
acclaim,""" v. praise enthusiastically and publicly. """"the conference was acclaimed as a considerable success"""" """,əˈklām,"praise, applaud, cheer, commend, approve, welcome, pay tribute to, speak highly of, eulogize, compliment, celebrate, sing the praises of, rave about, heap praise on/upon, wax lyrical about, lionize, exalt, admire, hail, extol, honor, hymn",
reclaim,""" v. retrieve or recover (something previously lost, given, or paid); obtain the return of. """"he returned three years later to reclaim his title as director of advertising"""" """"traveling expenses can be reclaimed""""   v. bring (waste land or land formerly under water) under cultivation. """"little money is available to reclaim and cultivate the desert""""""",rəˈklām,"get back, recoup, claim back, recover, regain, retrieve",
pertinacious,""" adj. holding firmly to an opinion or a course of action. """"he worked with a pertinacious resistance to interruptions"""" """,ˌpərtnˈāSHəs,"determined, tenacious, persistent, persevering, purposeful, resolute, dogged, indefatigable, insistent, single-minded, unrelenting, relentless, tireless, unshakable",
bridle,""" v. show one's resentment or anger, especially by throwing up the head and drawing in the chin. """"ranchers have bridled at excessive federal control"""" """"William seemed to bridle at the brusque manner of questioning""""""",ˈbrīdl,"bristle, take offense, take umbrage, be affronted, be offended, get angry",
prod,""" v. poke (someone) with a finger, foot, or pointed object. """"he prodded her in the ribs to stop her snoring"""" """"Cassie prodded him in the chest""""""",präd,"poke, jab, dig, elbow, butt, stab",
goad,""" v. provoke or annoy (someone) so as to stimulate some action or reaction. """"he goaded her on to more daring revelations"""" """,ɡōd,"provoke, spur, prod, egg on, hound, badger, incite, rouse, stir, move, stimulate, motivate, prompt, induce, encourage, urge, inspire",
rapture,""" n. a feeling of intense pleasure or joy. """"Leonora listened with rapture"""" """"she gazed at him in rapture""""""",ˈrapCHər,"ecstasy, bliss, exaltation, euphoria, elation, joy, enchantment, delight, happiness, pleasure",
rapt,""" adj. completely fascinated by what one is seeing or hearing. """"Andrew looked at her, rapt"""" """,rapt,"fascinated, enthralled, spellbound, captivated, riveted, gripped, mesmerized, enchanted, entranced, bewitched, moonstruck",
rapacious,""" adj. aggressively greedy or grasping. """"rapacious landlords"""" """,rəˈpāSHəs,"grasping, greedy, avaricious, acquisitive, covetous",
promulgate,""" v. promote or make widely known (an idea or cause). """"these objectives have to be promulgated within the organization"""" """"they promulgated their own views""""   v. put (a law or decree) into effect by official proclamation. """"in January 1852, the new constitution was promulgated"""" """"the law was promulgated in 1942""""""",ˈpräməlˌɡāt,"make known, make public, publicize, spread, communicate, propagate, disseminate, broadcast, promote, preach, put into effect, enact, implement, enforce",
precocious,""" adj. (of a child) having developed certain abilities or proclivities at an earlier age than usual. """"he was a precocious, solitary boy"""" """"some of the boys were extremely precocious""""""",prəˈkōSHəs,"advanced for one's age, forward, mature, gifted, talented, clever, intelligent, quick",
peregrination,""" n. a journey, especially a long or meandering one. """"she kept Aunt Ilsa company on her peregrinations"""" """"such fascinating peregrinations you've experienced, Mr. Soo""""""",ˌperəɡrəˈnāSH(ə)n,"travels, wanderings, journeys, globe-trotting, voyages, expeditions, odysseys, trips, treks, excursions",
panache,""" n. flamboyant confidence of style or manner. """"he entertained Palm Springs society with great panache"""" """,pəˈnaSH,"flamboyance, confidence, self-assurance, style, flair, elan, dash, verve, zest, spirit, brio, éclat, vivacity, gusto, liveliness, vitality, energy",
paltry,""" adj. (of an amount) small or meager. """"she would earn a paltry $33 more each month""""    adj. petty; trivial. """"naval glory struck him as paltry"""" """,ˈpôltrē,"small, meager, trifling, insignificant, negligible, inadequate, insufficient, derisory, pitiful, pathetic, miserable, niggardly, beggarly, worthless, petty, trivial, unimportant, insignificant, inconsequential, of little account",
ligament,"n. a short band of tough, flexible, fibrous connective tissue that connects two bones or cartilages or holds together a joint.",ˈliɡəmənt,,
mendacious,""" adj. not telling the truth; lying. """"mendacious propaganda"""" """,menˈdāSHəs,"lying, untruthful, dishonest, deceitful, false, dissembling, insincere, disingenuous, hypocritical, fraudulent, double-dealing, two-faced, Janus-faced, two-timing, duplicitous, perjured",
libertine,""" n. a person, especially a man, who behaves without moral principles or a sense of responsibility, especially in sexual matters.    adj. characterized by a disregard of morality, especially in sexual matters. """"his more libertine impulses""""""",ˈlibərˌtēn,"philanderer, playboy, rake, roué, Don Juan, Lothario, Casanova, Romeo",
implausible,""" adj. (of an argument or statement) not seeming reasonable or probable; failing to convince. """"this is a blatantly implausible claim"""" """,imˈplôzəb(ə)l,"unlikely, improbable, questionable, doubtful, debatable",
preeminent,""" adj. surpassing all others; very distinguished in some way. """"the world's preeminent expert on asbestos"""" """"America's preeminent economist""""""",prēˈemənənt,"greatest, leading, foremost, best, finest, chief, outstanding, excellent, distinguished, prominent, eminent, important, top, famous, renowned, celebrated, illustrious, supreme, marquee",
hapless,""" adj. (especially of a person) unfortunate. """"if you're one of the many hapless car buyers who've been shafted"""" """,ˈhapləs,"unfortunate, unlucky, luckless, out of luck, ill-starred, ill-fated, jinxed, cursed, doomed",
haphazard,""" adj. lacking any obvious principle of organization. """"the kitchen drawers contained a haphazard collection of silver souvenir spoons"""" """,ˌhapˈhazərd,"random, unplanned, unsystematic, unmethodical, disorganized, disorderly, irregular, indiscriminate, chaotic, hit-and-miss, arbitrary, aimless, careless, casual, slapdash, slipshod",
seminal,""" adj. (of a work, event, moment, or figure) strongly influencing later developments. """"his seminal work on chaos theory""""    adj. relating to or denoting semen.""",ˈsemənl,"influential, formative, groundbreaking, pioneering, original, innovative",
imprecate,v. utter (a curse) or invoke (evil) against someone or something.,ˈimprəˌkāt,,
debase,""" v. reduce (something) in quality or value; degrade. """"the love episodes debase the dignity of the drama"""" """,dəˈbās,"degrade, devalue, demean, cheapen, prostitute, discredit, drag down, tarnish, blacken, blemish",
self-effacing,""" adj. not claiming attention for oneself; retiring and modest. """"his demeanor was self-effacing, gracious, and polite""""""",ˈˌself əˈfāsiNG,,
sedentary,"adj. (of a person) tending to spend much time seated; somewhat inactive. synonyms: sitting, seated, desk-bound, stationary",ˈsednˌterē,,
unscathed,""" adj. without suffering any injury, damage, or harm. """"I came through all those perils unscathed"""" """"remarkably, the passengers were unscathed""""""",ˌənˈskāT͟Hd,"unharmed, unhurt, uninjured, undamaged, in one piece, intact, safe (and sound), unmarked, untouched, without a scratch",
scathing,""" adj. witheringly scornful; severely critical. """"she launched a scathing attack on the governor"""" """"another restaurant has fallen victim to one of her scathing reviews""""""",ˈskāT͟HiNG,"devastating, extremely critical, blistering, searing, withering, scorching, fierce, ferocious, savage, severe, stinging, biting, cutting, mordant, trenchant, virulent, caustic, vitriolic, scornful, sharp, bitter, harsh, unsparing",
retrogression,""" n. the process of returning to an earlier state, typically a worse one. """"a kind of extreme retrogression to 19th-century attitudes""""""",ˌretrəˈɡreSHən,,
retrospect,n. a survey or review of a past course of events or period of time.,ˈretrəˌspekt,,
reproof,""" n. an expression of blame or disapproval.  """"she welcomed him with a mild reproof for leaving her alone"""" """,rəˈpro͞of,"rebuke, reprimand, reproach, admonishment, admonition",
recede,""" v. go or move back or further away from a previous position. """"the flood waters had receded""""    v. (of a quality, feeling, or possibility) gradually diminish. """"the prospects of an early end to the war receded"""" """"fears of violence have receded""""""",rəˈsēd,"retreat, go back, go down, move back, move away, withdraw, ebb, subside, abate, diminish, lessen, decrease, dwindle, fade, abate, subside, ebb, wane",
penitent,""" adj. feeling or showing sorrow and regret for having done wrong; repentant. """"a penitent expression"""" """"she stood there looking like a penitent child""""""",ˈpenətnt,"repentant, contrite, remorseful, sorry, apologetic, regretful, conscience-stricken, rueful, ashamed, shamefaced, abject, in sackcloth and ashes",
indigenous,""" adj. originating or occurring naturally in a particular place; native. """"the indigenous peoples of Siberia"""" """,inˈdijənəs,"native, original, aboriginal, autochthonous",
fathom,""" n. a unit of length equal to six feet (approximately 1.8 m), chiefly used in reference to the depth of water. """"sonar says that we're in eighteen fathoms""""   v. understand (a difficult problem or an enigmatic person) after much thought. """"he could scarcely fathom the idea that people actually lived in Las Vegas""""    v. measure the depth of (water). """"an attempt to fathom the ocean"""" """"fathoming the ocean""""""",ˈfaT͟Həm,"understand, comprehend, work out, make sense of, grasp, divine, puzzle out, get to the bottom of, measure the depth of, sound, plumb",
exemplary,""" adj. serving as a desirable model; representing the best of its kind. """"an award for exemplary community service""""    adj. (of a punishment) serving as a warning or deterrent. """"exemplary sentencing may discourage the ultraviolent minority"""" """"exemplary jail sentences""""""",iɡˈzemplərē,"perfect, ideal, model, faultless, flawless, impeccable, irreproachable, deterrent, cautionary, warning, admonitory",
enshrine,""" v. preserve (a right, tradition, or idea) in a form that ensures it will be protected and respected. """"the right of all workers to strike was enshrined in the new constitution"""" """"the following rights should be enshrined in the treaty""""""",inˈSHrīn,"preserve, entrench, set down, lay down, set in stone, embody, incorporate, contain, include, treasure, immortalize, cherish",
engender,""" v. cause or give rise to (a feeling, situation, or condition). """"the issue engendered continuing controversy"""" """,ənˈjendər,"cause, be the cause of, give rise to, bring about, occasion, lead to, result in, produce, create, generate, arouse, rouse, inspire, provoke, prompt, kindle, trigger, spark, stir up, whip up, induce, incite, instigate, foment",
affront,"""  n. an action or remark that causes outrage or offense. """"he took his son's desertion as a personal affront""""    v. offend the modesty or values of. """"she was affronted by his familiarity"""" """,əˈfrənt,"insult, offense, indignity, slight, snub, put-down, provocation, injury, insult, offend, mortify, provoke, pique, wound, hurt",
douse,""" v. pour a liquid over; drench. """"he doused the car with gasoline and set it on fire"""" """"sprayers doused the fields next to us with pesticides""""   v. extinguish (a fire or light). """"stewards appeared and the fire was doused"""" """"a guard doused the flames""""""",dous,"drench, soak, saturate, wet, splash, slosh, extinguish, put out, quench, smother, snuff (out)",
despondent,"adj. in low spirits from loss of hope or courage. synonyms: disheartened, discouraged, dispirited, downhearted, downcast, crestfallen, down, low, disconsolate, despairing, wretched",dəˈspändənt,,
deplore,""" v. feel or express strong disapproval of (something). """"we deplore this act of violence"""" """,dəˈplôr,"abhor, find unacceptable, frown on, disapprove of, take a dim view of, take exception to",
deferential,""" adj. showing deference; respectful. """"people were always deferential to him"""" """,ˌdefəˈren(t)SH(ə)l,"respectful, humble, obsequious",
infamy,""" n. the state of being well known for some bad quality or deed. """"a day that will live in infamy"""" """,ˈinfəmē,"notoriety, disrepute, ill fame, disgrace, discredit, shame, dishonor, ignominy, scandal, censure, blame, disapprobation, condemnation",
decrepit,""" adj. (of a person) elderly and infirm. """"a decrepit old drunk""""    adj. worn out or ruined because of age or neglect. """"centuries-old buildings, now decrepit and black with soot"""" """,dəˈkrepət,"feeble, infirm, weak, weakly, frail, dilapidated, rickety, run-down, tumbledown, beat-up, ramshackle, derelict, ruined, in (a state of) disrepair, gone to rack and ruin",
conversant,""" adj. familiar with or knowledgeable about something. """"many ladies are conversant with the merits of drill-eyed needles"""" """,kənˈvərsənt,"familiar with, acquainted with, au fait with, au courant with, at home with, well versed in, well informed about, knowledgeable about, informed about, abreast of, up-to-date on",
homogenize,""" v. make uniform or similar. """"Hollywood is homogenizing American cinema""""""",həˈmäjəˌnīz,"make uniform, make similar, standardize, unite, integrate, fuse, merge, blend, meld, coalesce, amalgamate, combine",
degenerate,"""  adj. having lost the physical, mental, or moral qualities considered normal and desirable; showing evidence of decline. """"a degenerate form of a higher civilization"""" """"a degenerate form of classicism""""    v. decline or deteriorate physically, mentally, or morally. """"the quality of life had degenerated"""" """,dəˈjen(ə)rət,"debased, degraded, corrupt, impure, deteriorate, decline, slip, slide, worsen, lapse, slump, go downhill, regress, retrogress",
comity,n. an association of nations for their mutual benefit.   n. courtesy and considerate behavior toward others.,ˈkämədē,,
coagulate,""" v. (of a fluid, especially blood) change to a solid or semisolid state. """"blood had coagulated around the edges of the wound"""" """,kōˈaɡyəˌlāt,"congeal, clot, thicken, jell",
purse,""" v. (with reference to the lips) pucker or contract, typically to express disapproval or irritation. """"Marianne took a glance at her reflection and pursed her lips disgustedly"""" """"she pursed her lips""""""",pərs,"press together, compress, tighten, pucker, pout",
deity,""" n. a god or goddess (in a polytheistic religion). """"a deity of ancient Greece""""    n. divine status, quality, or nature. """"a ruler driven by delusions of deity""""""",ˈdēədē,"god, goddess, divine being, supreme being, divinity, immortal",
vertebrate,"n. an animal of a large group distinguished by the possession of a backbone or spinal column, including mammals, birds, reptiles, amphibians, and fishes.",ˈvərdəˌbrāt,,
allay,""" v. diminish or put at rest (fear, suspicion, or worry). """"the report attempted to educate the public and allay fears"""" """"nothing would allay his fears""""   v. relieve or alleviate (pain or hunger). """"some stale figs partly allayed our hunger""""""",əˈlā,"reduce, diminish, decrease, lessen, assuage, alleviate, ease, relieve, soothe, soften, calm, take the edge off",
vestibule,"""n. an antechamber, hall, or lobby next to the outer door of a building. """"brochures are available in the vestibule""""""",ˈvestəˌbyo͞ol,"entrance hall, hall, hallway, entrance, porch, portico, foyer, lobby, anteroom, narthex, antechamber, waiting room",
repatriate,""" v. send (someone) back to their own country. """"the United Nations hopes to repatriate all the refugees""""""",rēˈpātrēˌāt,,
