term,definition,ipa,synonyms,antonyms
vicissitude,""" n. a change of circumstances or fortune, typically one that is unwelcome or unpleasant. """"her husband's sharp vicissitudes of fortune"""" """,vəˈsisəˌt(y)o͞od,"change, alteration, shift, reversal, twist, turn, downturn, variation",
vertiginous,""" adj. causing vertigo, especially by being extremely high or steep. """"vertiginous drops to the valleys below""""""",vərˈtijənəs,,
untapped,""" adj. (of a resource) not yet exploited or used. """"a huge, untapped market for bagels""""""",ˌənˈtapt,,
unpremeditated,""" adj. (of an act, remark, or state) not thought out or planned beforehand. """"it was a totally unpremeditated attack"""" """,ˌənprēˈmedəˌtādəd,"unplanned, spontaneous, unprepared, impromptu, spur-of-the-moment, unrehearsed, ad lib, improvised, extemporaneous",
undergird,"v. secure or fasten from the underside, especially by a rope or chain passed underneath.",ˌəndərˈɡərd,,
turgid,""" adj. swollen and distended or congested. """"a turgid and fast-moving river"""" """"the tissues become turgid""""   adj. (of language or style) tediously pompous or bombastic. """"some turgid verses on the death of Prince Albert"""" """,ˈtərjəd,"swollen, distended, tumescent, engorged, bloated, tumid, bombastic, pompous, overblown, inflated, tumid, high-flown, puffed up, affected, pretentious, grandiose, florid, ornate, grandiloquent, orotund",
transmogrify,""" v. transform, especially in a surprising or magical manner. """"the cucumbers that were ultimately transmogrified into pickles""""""",transˈmäɡrəˌfī,,
trammel,""" v. deprive of freedom of action. """"those less trammeled by convention than himself"""" """,ˈtraməl,"restrict, restrain, constrain, hamper, confine, hinder, handicap, obstruct, impede, hold back, tie down, hamstring, shackle, fetter",
temerarious,adj. reckless; rash.,ˌteməˈrerēəs,,
somnolent,"adj. sleepy; drowsy. synonyms: sleepy, drowsy, tired, languid, dozy, groggy, lethargic, sluggish, enervated, torpid",ˈsämnələnt,,
snare,""" n. a trap for catching birds or animals, typically one having a noose of wire or cord. """"the hare was caught in a snare""""   v. catch (a bird or mammal) in a snare. """"game birds were snared""""""",sner,"trap, gin, net, noose, trap, catch, net, bag, ensnare, entrap",
skittish,""" adj. (of an animal, especially of a horse) excitable or easily scared. """"a skittish chestnut mare"""" """"going to the dentist makes me skittish""""   adj. (of a person) playfully frivolous or unpredictable. """"my skittish and immature mother""""""",ˈskidiSH,"nervous, anxious, on edge, excitable, restive, skittery, jumpy, jittery, high-strung",
skinflint,"n. a person who spends as little money as possible; a miser. synonyms: miser, penny-pincher, Scrooge, pinchpenny",ˈskinˌflint,,
roundabout,""" adj. not following a short direct route; circuitous. """"we need to take a roundabout route to throw off any pursuit"""" """"a roundabout route""""""",ˈroundəˌbout,"circuitous, indirect, meandering, serpentine, tortuous",
reconnoiter,""" v. make a military observation of (a region). """"they reconnoitered the beach some weeks before the landing"""" """,ˌrēkəˈnoidər,"survey, make a reconnaissance of, explore",
raucous,""" adj. making or constituting a disturbingly harsh and loud noise. """"raucous youths"""" """,ˈrôkəs,"harsh, strident, screeching, piercing, shrill, grating, discordant, dissonant",
purview,""" n. the scope of the influence or concerns of something. """"such a case might be within the purview of the legislation""""   n. a range of experience or thought. """"social taboos meant that little information was likely to come within the purview of women generally""""""",ˈpərˌvyo͞o,,
pronounced,""" adj. very noticeable or marked; conspicuous. """"he had a pronounced squint"""" """"a pronounced German accent""""""",prəˈnounst,"noticeable, marked, strong, conspicuous, striking, distinct, prominent, unmistakable, obvious, recognizable, identifiable",
proffer,""" v. hold out (something) to someone for acceptance; offer. """"he proffered his resignation"""" """,ˈpräfər,"offer, tender, submit, extend, volunteer, suggest, propose, put forward; hold out",
procreate,""" v. (of people or animals) produce young; reproduce. """"species that procreate by copulation"""" """"the biological imperative to procreate""""""",ˈprōkrēˌāt,"produce offspring, reproduce, multiply, propagate, breed",
petrify,""" v. change (organic matter) into a stony concretion by encrusting or replacing its original substance with a calcareous, siliceous, or other mineral deposit. """"petrified remains of prehistoric animals""""   v. make (someone) so frightened that they are unable to move or think. """"his icy controlled quietness petrified her"""" """,ˈpetrəˌfī,"ossified, fossilized, calcified, terrified, terror-stricken, horrified, scaredfrightened to death",
pathos,""" n. a quality that evokes pity or sadness. """"the actor injects his customary humor and pathos into the role"""" """"the pathos of Antoine's predicament""""""",ˈpāˌTHäs,"poignancy, tragedy, sadness, pitifulness, piteousness, pitiableness",
overwrought,""" adj. in a state of nervous excitement or anxiety. """"she was too overwrought to listen to reason""""    adj. (of a piece of writing or a work of art) too elaborate or complicated in design or construction. """"the painting is overwrought""""""",ˌōvəˈrôt,"tense, agitated, nervous, on edge, edgy, keyed up, worked up, high-strung, neurotic, overexcited, beside oneself, distracted, distraught, frantic, hysterical, overelaborate, overornate, overblown, overdone, contrived, overworked, strained",
facade,""" n. the face of a building, especially the principal front that looks onto a street or open space. """"a vinyl-sided facade""""   n. an outward appearance that is maintained to conceal a less pleasant or creditable reality. """"her flawless public facade masked private despair"""" """"a facade of bonhomie""""""",fəˈsäd,"front, frontage, face, elevation, exterior, outside, show, front, appearance, pretense, simulation, affectation, semblance, illusion, act, masquerade, charade, mask, cloak, veil, veneer",
vacancy,""" n. an unoccupied position or job. """"a vacancy for a shorthand typist"""" """"there are vacancies for computer technicians""""   n. empty space. """"Cathy stared into vacancy, seeing nothing""""""",ˈvākənsē,"opening, position, post, job, opportunity, place",
untrammeled,""" adj. not deprived of freedom of action or expression; not restricted or hampered. """"a mind untrammeled by convention""""""",ˌənˈtraməld,,
craven,""" adj. contemptibly lacking in courage; cowardly. """"a craven abdication of his moral duty"""" """,ˈkrāvən,"cowardly, lily-livered, faint-hearted, chicken-hearted, spineless, timid, timorous, fearful, pusillanimous, weak, feeble",
sybarite,""" n. a person who is self-indulgent in their fondness for sensuous luxury. """"an exclusive resort that caters to wealthy sybarites""""""",ˈsibəˌrīt,"hedonist, sensualist, voluptuary, libertine, pleasure-seeker, epicure, bon vivant, bon viveur",
drab,""" adj. lacking brightness or interest; drearily dull. """"the landscape was drab and gray"""" """,drab,"colorless, gray, dull, washed out, muted, lackluster",
misnomer,""" n. a wrong or inaccurate name or designation. """"“king crab” is a misnomer—these creatures are not crustaceans at all"""" """"scientists say “killer whale” is a misnomer for what is one of the gentlest marine creatures known to man""""""",misˈnōmər,"inaccurate namedesignation, wrong namedesignation, inappropriate namedesignation",
quaint,""" adj. attractively unusual or old-fashioned. """"quaint country cottages"""" """,kwānt,"picturesque, charming, sweet, attractive, old-fashioned, old-world, cunning",
decamp,""" v. depart suddenly or secretly, especially to relocate one's business or household in another area. """"now he has decamped to Hollywood"""" """,dəˈkamp,"abscond, make off, run off/away, flee, bolt, take flight, disappear, vanish, steal away, sneak away, escape, make a run for it, leave, depart",
con,""" v. persuade (someone) to do or believe something, typically by use of a deception. """"I conned him into giving me your home number""""    n. an instance of deceiving or tricking someone. """"a con artist"""" """,kän,"swindle, defraud, cheat, trick, fleece, dupe, deceive, rook, exploit, squeeze, milk, bleed, swindle, deception, trick, racket, bit of sharp practice, fraud",
maddening,""" adj. extremely annoying; infuriating. """"his maddening stories""""""",ˈmad(ə)niNG,,
hiss,""" v. express disapproval of (someone) by hissing. """"he was hissed off the stage""""    v. make a sharp sibilant sound as of the letter s. """"the escaping gas was now hissing"""" """,his,"jeer, catcall, boo, heckle, whistle, hoot, fizz, fizzle, whistle, wheeze",
renunciation,""" n. the formal rejection of something, typically a belief, claim, or course of action. """"entry into the priesthood requires renunciation of marriage"""" """,rəˌnənsēˈāSH(ə)n,"abstention from, refraining from, going without, giving up, eschewal of",
gibber,""" v. speak rapidly and unintelligibly, typically through fear or shock. """"they shrieked and gibbered as flames surrounded them"""" """,ˈjibər,"prattle, babble, ramble, drivel, jabber, gabble, burble, twitter, mutter, mumble",
preternatural,""" adj. beyond what is normal or natural. """"autumn had arrived with preternatural speed"""" """,ˌprēdərˈnaCH(ə)rəl,"extraordinary, exceptional, unusual, uncommon, singular, unprecedented, remarkable, phenomenal, abnormal, inexplicable, unaccountable",
graze,""" v. (of cattle, sheep, etc.) eat grass in a field. """"cattle graze on the open meadows"""" """"the deer grazed""""""",ɡrāz,"feed, eat, nibble, browse",
rampant,""" adj. (especially of something unwelcome or unpleasant) flourishing or spreading unchecked. """"political violence was rampant"""" """,ˈrampənt,"uncontrolled, unrestrained, unchecked, unbridled, widespread",
grade,""" v. arrange in or allocate to grades; class or sort. """"they are graded according to thickness""""    v. pass gradually from one level, especially a shade of color, into another. """"the sky graded from blue to white on the horizon"""" """"the colors grade into one another""""""",ɡrād,"classify, class, categorize, bracket, sort, group, arrange, pigeonhole, blend, shade, merge, pass",
acquiesce,"""  v. accept something reluctantly but without protest. """"Sara acquiesced in his decision"""" """,ˌakwēˈes,"permit, consent to, agree to, allow, assent to, give one's consent to, accept, concur with, give one's assent to, give one's blessing to, say yes to, give the nod to, give one's approval to",
taxonomy,"n. the branch of science concerned with classification, especially of organisms; systematics.",takˈsänəmē,,
toxicology,"n. the branch of science concerned with the nature, effects, and detection of poisons.",ˌtäksəˈkäləjē,,
blasé,""" adj. unimpressed or indifferent to something because one has experienced or seen it so often before. """"she was becoming quite blasé about the dangers"""" """"these children have learned to be blasé about the sound of gunfire""""""",bläˈzā,"indifferent, unconcerned, uncaring, casual, nonchalant, offhand, uninterested, apathetic, unimpressed, unmoved, surfeited, jaded, unresponsive, phlegmatic",
maculate,v. mark with a spot or spots; stain.,ˈmakyəˌlāt,,
dabble,""" v. immerse (one's hands or feet) partially in water and move them around gently. """"they dabbled their feet in the rock pools""""    v. take part in an activity in a casual or superficial way. """"he dabbled in writing as a young man"""" """"he dabbled in politics""""""",ˈdabəl,"splash, dip, paddle, trail; immerse, toy with, dip into, flirt with, tinker with, trifle with, play with, dally with",
dingy,""" adj. gloomy and drab. """"a dingy room"""" """,ˈdinjē,"gloomy, dark, dull, badly/poorly lit, murky, dim, dismal, dreary, drab, somber, grim, cheerless",
rout,""" v. defeat and cause to retreat in disorder. """"in a matter of minutes the attackers were routed"""" """,rout,"put to flight, put to rout, drive off, dispel, scatter",
septuagenarian,n. a person who is from 70 to 79 years old.,sepCHo͞oəjəˈnerēən,,
exasperation,""" n. a feeling of intense irritation or annoyance. """"she rolled her eyes in exasperation"""" """,iɡˌzaspəˈrāSH(ə)n,"irritation, annoyance, vexation, anger, fury, rage, ill humor, crossness, testiness, tetchiness",
exaggerate,""" v. represent (something) as being larger, greater, better, or worse than it really is. """"they were apt to exaggerate any aches and pains"""" """,iɡˈzajəˌrāt,"overstate, overemphasize, overestimate, magnify, amplify, aggrandize, inflate",
tenet,""" n. a principle or belief, especially one of the main principles of a religion or philosophy. """"the tenets of classical liberalism"""" """,ˈtenət,"principle, belief, doctrine, precept, creed, credo, article of faith, axiom, dogma, canon",
demote,""" v. give (someone) a lower rank or less senior position, usually as a punishment. """"the head of the army was demoted to deputy defense secretary"""" """,dēˈmōt,"downgrade, relegate, declass, reduce in rank",
concave,"adj. having an outline or surface that curves inward like the interior of a circle or sphere. synonyms: incurvate, curved inward, hollow, depressed, sunken",känˈkāv,,
dissolute,""" adj. lax in morals; licentious. """"a dissolute, drunken, disreputable rogue"""" """,ˈdisəˌlo͞ot,"dissipated, debauched, decadent, intemperate, profligate, self-indulgent, wild, depraved",
tantrum,""" n. an uncontrolled outburst of anger and frustration, typically in a young child. """"he has temper tantrums if he can't get his own way"""" """"how can you tolerate his tantrums?""""""",ˈtantrəm,"fit of temper, fit of rage, fit, outburst, pet, paroxysm, frenzy, bad mood, mood, huff, scene",
oxymoron,"n. a figure of speech in which apparently contradictory terms appear in conjunction (e.g., faith unfaithful kept him falsely true ).",ˌäksəˈmôrˌän,,
red-handed,""" adj. (of a person) having been discovered in or just after the act of doing something wrong or illegal. """"I caught him red-handed, stealing a wallet"""" """"the thief was caught red-handed""""""",ˌred ˈhandəd,"in the act, with one's fingers/hand in the till, with one's hand in the cookie jar, in flagrante delicto",
sluggish,""" adj. slow-moving or inactive. """"a sluggish stream"""" """"the economy is sluggish""""""",ˈsləɡiSH,"inactive, quiet, slow, slack, flat, depressed, stagnant",
factual,""" adj. concerned with what is actually the case rather than interpretations of or reactions to it. """"a mixture of comment and factual information"""" """,ˈfak(t)SH(o͞o)əl,"truthful, true, accurate, authentic, historical, genuine, fact-based",
interdict,""" v. prohibit or forbid (something). """"society will never interdict sex""""    v. intercept and prevent the movement of (a prohibited commodity or person). """"the police established roadblocks throughout the country for interdicting drugs"""" """,ˌin(t)ərˈdikt,"prohibit, forbid, ban, bar, veto, proscribe, embargo, disallow, debar, outlaw, intercept, stop, head off, cut off",
extradite,""" v. hand over (a person accused or convicted of a crime) to the jurisdiction of the foreign state in which the crime was committed. """"Greece refused to extradite him to Italy"""" """"the Russians extradited him to Germany""""""",ˈekstrəˌdīt,"deport, send, ship, deliver, hand over; repatriate",
chartered,"adj. (of an accountant, engineer, librarian, etc.) qualified as a member of a professional body that has a royal charter.",ˈCHärdərd,,
charter,""" n. a written grant by a country's legislative or sovereign power, by which an institution such as a company, college, or city is created and its rights and privileges defined.    v. grant a charter to (a city, college, or other institution). """"the company was chartered in 1553""""   v. reserve (an aircraft, boat, or bus) for private use. """"he chartered a plane to take him to Paris"""" """,ˈCHärdər,"authority, authorization, sanction, dispensation, consent, permission, hire, lease, rent",
séance,"n. a meeting at which people attempt to make contact with the dead, especially through the agency of a medium.",ˈsāˌäns,,
enmesh,""" v. cause to become entangled in something. """"whales enmeshed in drift nets"""" """"before he knew it, Reid was enmeshed in the gang mentality""""""",inˈmeSH,"embroil, entangle, ensnare, snare, trap, entrap, ensnarl, involve, catch up, mix up, bog down, mire",
wastrel,n. a wasteful or good-for-nothing person.,ˈwāstrəl,,
tavern,"n. an establishment for the sale of beer and other drinks to be consumed on the premises, sometimes also serving food. synonyms: bar, pub, cocktail lounge, lounge, taproom, nightclub, roadhouse, club",ˈtavərn,,
badmouth,""" v. criticize (someone or something); speak disloyally of. """"no one wants to hire an individual who bad-mouths a prior employer""""""",ˈbadˌmouTH,,
amiable,""" adj. having or displaying a friendly and pleasant manner. """"an amiable, unassuming fellow"""" """,ˈāmēəb(ə)l,"friendly, affable, amicable, cordial",
cynic,""" n. a person who believes that people are motivated purely by self-interest rather than acting for honorable or unselfish reasons. """"some cynics thought that the controversy was all a publicity stunt""""""",ˈsinik,,
chantey,"n. a song with alternating solo and chorus, of a kind originally sung by sailors while performing physical labor together.",ˈSHan(t)ē,,
analgesic,adj. (chiefly of a drug) acting to relieve pain.,ˌanlˈjēzik,,
salve,""" n. an ointment used to promote healing of the skin or as protection.    v. soothe (wounded pride or one's conscience). """"charity salves our conscience"""" """"she did it to salve her conscience""""""",sav,"ointment, cream, balm, unguent, emollient, soothe, assuage, ease, allay, lighten, alleviate, comfort, mollify",
latitude,"""n. scope for freedom of action or thought. """"journalists have considerable latitude in criticizing public figures"""" """"he gave them a lot of latitude""""    n. the angular distance of a place north or south of the earth's equator, or of a celestial object north or south of the celestial equator, usually expressed in degrees and minutes. """"at a latitude of 51° N"""" """"Toronto shares the same latitude as Nice""""""",ˈladəˌt(y)o͞od,"freedom, scope, leeway, space, breathing space, flexibility, liberty, independence, free rein, license, room to maneuver, elbow room, wiggle room, freedom of action, parallel, grid line",restriction
regality,n. the state of being a king or queen.,rēˈɡalədē,,
balmy,""" adj. (of the weather) pleasantly warm. """"the balmy days of late summer"""" """"the balmy breezes of the West Indies""""""",ˈbä(l)mē,"mild, gentle, temperate, summery, calm, tranquil, clement, fine, pleasant, benign, soothing, soft",
cant,""" n. hypocritical and sanctimonious talk, typically of a moral, religious, or political nature. """"the liberal case against all censorship is often cant"""" """"political cant""""   n. denoting a phrase or catchword temporarily current or in fashion. """"they are misrepresented as, in the cant word of our day, uncaring""""""",kant,"hypocrisy, sanctimoniousness, sanctimony, pietism",
repertoire,""" n. a stock of plays, dances, or pieces that a company or a performer knows or is prepared to perform. """"the three tenors will fashion their repertoire to their audiences""""    n. the whole body of items that are regularly performed. """"the mainstream concert repertoire""""   n. a stock of skills or types of behavior that a person habitually uses. """"his repertoire of threats, stares, and denigratory gestures""""""",ˈrepə(r)ˌtwär,"collection, stock, range, repertory, reserve, store, repository, supply",
servitude,""" n. the state of being a slave or completely subject to someone more powerful. """"born into a life of servitude""""""",ˈsərvəˌt(y)o͞od,"slavery, enslavement, bondage, subjugation, subjection, domination",
indenture,""" n. a formal legal agreement, contract, or document, in particular. """"the validity of the indenture was in question""""""",ˌinˈden(t)SHər,"contract, agreement, compact, deal, covenant, bond",
verse,""" n. writing arranged with a metrical rhythm, typically having a rhyme. """"a lament in verse"""" """,vərs,"poetry, versification, poetic form",
gourmet,""" n. a connoisseur of good food; a person with a discerning palate.    n. of a kind or standard suitable for a gourmet. modifier noun: gourmet """"a gourmet meal""""""",ˌɡôrˈmā,"gastronome, epicure, epicurean",
expertise,""" n. expert skill or knowledge in a particular field. """"technical expertise"""" """,ˌekspərˈtēz,"skill, skillfulness, expertness, prowess, proficiency, competence",
underlie,""" v. be the cause or basis of (something). """"the fundamental issue that underlies the conflict"""" """"the underlying aims of the research""""""",ˌəndərˈlī,"fundamental, basic, primary, prime, central, principal, root, chief, cardinal, key, elementary, intrinsic, essential",
bob,""" v. (of a thing) make a quick short movement up and down. """"I could see his red head bobbing around"""" """,bäb,"move up and down, bounce, toss, skip, dance, jounce",
jovial,""" adj. cheerful and friendly. """"she was in a jovial mood"""" """,ˈjōvēəl,"cheerful, jolly, happy, cheery, good-humored, convivial, genial, good-natured, friendly, amiable, affable, sociable, outgoing",
char,""" v. partially burn (an object) so as to blacken its surface. """"their bodies were badly charred in the fire"""" """"the steaks should be slightly charred""""""",CHär,"scorch, burn, singe, sear, blacken",
sunken,""" adj. having sunk or been submerged in water. """"the wreck of a sunken ship""""   adj. at a lower level than the surrounding area. """"a sunken garden"""" """,ˈsəNGkən,"below ground level, at a lower level, lowered",
underplay,""" v. perform (something) in a restrained way. """"the violins underplayed the romantic element in the music""""   v. represent (something) as being less important than it actually is. """"I do not wish to underplay the tragedies that have occurred""""""",ˌəndərˈplā,,
seethe,""" v. (of a liquid) bubble up as a result of being boiled. """"the brew foamed and seethed""""    v. (of a person) be filled with intense but unexpressed anger. """"inwardly he was seething at the slight to his authority"""" """,sēT͟H,"boil, bubble, simmer, foam, froth, fizz, effervesce, be angry, be furious, be enraged, be incensed, be beside oneself, boil, simmer, rage, rant, rave, storm, fume, smolder",
recidivism,""" n. the tendency of a convicted criminal to reoffend. """"the prison has succeeded in reducing recidivism""""""",rəˈsidəˌvizəm,,
squiggle,""" n. a short line that curls and loops in an irregular way. """"some prescriptions are a series of meaningless squiggles"""" """"their logo is the one with the two purple squiggles above the letter """"Q""""""""   v. wriggle; squirm. """"a worm that squiggled in his palm""""""",ˈskwiɡəl,"wavy line, doodle",
knuckle,""" n. a part of a finger at a joint where the bone is near the surface, especially where the finger joins the hand. """"Charlotte rapped on the window with her knuckles""""""",ˈnək(ə)l,,
sloppy,""" adj. careless and unsystematic; excessively casual. """"your speech has always been sloppy""""    adj. (of a garment) casual and loose-fitting. """"she wore a sloppy sweater and jeans"""" """,ˈsläpē,"careless, slapdash, slipshod, lackadaisical, haphazard, lax, slack, slovenly, baggy, loose-fitting, loose, generously cut",
thwack,""" v. strike forcefully with a sharp blow. """"she thwacked the back of their knees with a cane""""""",THwak,,
parse,""" v. analyze (a sentence) into its parts and describe their syntactic roles.   v. examine or analyze minutely. """"he has always been quick to parse his own problems in public""""""",pärs,,
stake,""" v. support (a tree or plant) with a stake or stakes. """"the plants have to be staked""""   v. mark an area with stakes so as to claim ownership of it. """"the boundary between the two ranches was properly staked out"""" """"builders staked out the plot""""""",stāk,"prop up, tie up, tether, support, hold up, brace, truss, mark off/out, demarcate, measure out, delimit, fence off, section off, close off, shut off, cordon off",
bellwether,""" n. an indicator or predictor of something. """"college campuses are often the bellwether of change"""" """"a bellwether of change""""   n. the leading sheep of a flock, with a bell on its neck.""",ˈbelˌweT͟Hər,"harbinger, herald, indicator, predictor",
potentate,""" n. a monarch or ruler, especially an autocratic one. """"diplomatic missions to foreign potentates""""""",ˈpōtnˌtāt,"ruler, monarch, sovereign, king, queen, emperor, empress, sultan, shah, raja, pharaoh",
convene,""" v. come or bring together for a meeting or activity; assemble. """"he convened a group of well-known scientists and philosophers"""" """,kənˈvēn,"summon, call, call together, order",
convoy,""" n. a group of ships or vehicles traveling together, typically accompanied by armed troops, warships, or other vehicles for protection. """"a convoy of vehicles""""   v. (of a warship or armed troops) accompany (a group of ships or vehicles) for protection. """,ˈkänˌvoi,"group, fleet, cavalcade, motorcade, cortège, caravan, line, train, escort, accompany, attend, flank",
thrash,""" v. beat (a person or animal) repeatedly and violently with a stick or whip. """"she thrashed him across the head and shoulders"""" """,THraSH,"hit, beat, strike, batter, thump, hammer, pound, rain blows on",
